{
  "model_id": "zero-dce",
  "artifact_sha256": "b73dfcec78c969af4b9da33a59b9483961b22dafae637d5551831ec10958d522",
  "device": {
    "model": "M2101K6G",
    "android_release": "13",
    "android_sdk": 33,
    "build_fingerprint": "Redmi\/sweet_global\/sweet:13\/TKQ1.221013.002\/V14.0.8.0.TKFMIXM:user\/release-keys",
    "soc": "SM7150"
  },
  "runtime": {
    "name": "onnxruntime",
    "version": "1.19.2"
  },
  "backend": "cpu",
  "precision": "float32",
  "image_ids": [
    "1.png",
    "111.png",
    "146.png",
    "179.png",
    "22.png",
    "23.png",
    "493.png",
    "547.png",
    "55.png",
    "665.png",
    "669.png",
    "748.png",
    "778.png",
    "780.png",
    "79.png"
  ],
  "warmup_count": 5,
  "load_time_ns": 158854375,
  "images": [
    {
      "image_id": "1.png",
      "model_ns": [
        928840156,
        936869791,
        940142396
      ],
      "e2e_ns": [
        928857239,
        936879427,
        940152552
      ]
    },
    {
      "image_id": "111.png",
      "model_ns": [
        942511250,
        948875781,
        947260885
      ],
      "e2e_ns": [
        942529895,
        948885156,
        947271094
      ]
    },
    {
      "image_id": "146.png",
      "model_ns": [
        940154218,
        937844375,
        948923020
      ],
      "e2e_ns": [
        940172343,
        937853698,
        948934322
      ]
    },
    {
      "image_id": "179.png",
      "model_ns": [
        955807395,
        971857240,
        957294896
      ],
      "e2e_ns": [
        955824426,
        971871771,
        957305624
      ]
    },
    {
      "image_id": "22.png",
      "model_ns": [
        966071770,
        955776458,
        955804531
      ],
      "e2e_ns": [
        966090208,
        955787448,
        955816093
      ]
    },
    {
      "image_id": "23.png",
      "model_ns": [
        953365729,
        981349635,
        962845833
      ],
      "e2e_ns": [
        953381562,
        981358697,
        962856354
      ]
    },
    {
      "image_id": "493.png",
      "model_ns": [
        980397969,
        963760729,
        970029270
      ],
      "e2e_ns": [
        980417448,
        963771250,
        970040156
      ]
    },
    {
      "image_id": "547.png",
      "model_ns": [
        978070000,
        959580573,
        958462969
      ],
      "e2e_ns": [
        978087291,
        959593437,
        958476406
      ]
    },
    {
      "image_id": "55.png",
      "model_ns": [
        959550676,
        960405937,
        958398177
      ],
      "e2e_ns": [
        959568489,
        960416458,
        958408697
      ]
    },
    {
      "image_id": "665.png",
      "model_ns": [
        965437083,
        959746927,
        970506562
      ],
      "e2e_ns": [
        965456614,
        959757812,
        970519115
      ]
    },
    {
      "image_id": "669.png",
      "model_ns": [
        963803854,
        965648229,
        963525781
      ],
      "e2e_ns": [
        963820989,
        965659166,
        963536458
      ]
    },
    {
      "image_id": "748.png",
      "model_ns": [
        975595104,
        986472760,
        958989531
      ],
      "e2e_ns": [
        975611927,
        986485781,
        959000677
      ]
    },
    {
      "image_id": "778.png",
      "model_ns": [
        962827448,
        966012448,
        957938802
      ],
      "e2e_ns": [
        962846354,
        966023385,
        957949167
      ]
    },
    {
      "image_id": "780.png",
      "model_ns": [
        962798958,
        1078413906,
        1119817395
      ],
      "e2e_ns": [
        962816354,
        1078436770,
        1119829374
      ]
    },
    {
      "image_id": "79.png",
      "model_ns": [
        1068816875,
        1063842812,
        1073685989
      ],
      "e2e_ns": [
        1068837395,
        1063855833,
        1073695937
      ]
    }
  ],
  "pss": {
    "samples_mb": [
      35.9384765625,
      132.4794921875,
      264.8359375,
      260.4033203125,
      460.76953125,
      471.8359375,
      471.85546875,
      456.8515625,
      456.86328125,
      467.9052734375,
      467.9208984375,
      448.7763671875,
      457.1396484375,
      457.1552734375,
      459.810546875,
      459.822265625,
      475.2529296875,
      475.1591796875,
      481.6943359375,
      481.7138671875,
      462.2490234375,
      462.2607421875,
      473.3271484375,
      484.5146484375,
      467.9013671875,
      478.9560546875,
      478.9716796875,
      456.7724609375,
      456.7880859375,
      467.8427734375,
      468.9873046875,
      468.8193359375,
      468.8310546875,
      456.7724609375,
      467.8271484375,
      467.8427734375,
      462.4013671875,
      462.4130859375,
      456.7607421875,
      456.7724609375,
      467.8271484375,
      467.8427734375,
      465.1474609375,
      459.5146484375,
      459.5263671875,
      475.1787109375,
      475.1943359375,
      459.5224609375,
      459.5341796875,
      470.5888671875,
      470.6044921875,
      481.6552734375,
      481.6748046875,
      459.5224609375,
      459.5341796875,
      470.5888671875,
      481.6435546875,
      481.6552734375,
      462.2763671875,
      462.2880859375,
      477.9404296875,
      477.9638671875,
      473.4130859375,
      473.4248046875,
      476.1708984375,
      476.1826171875,
      462.2880859375,
      473.3388671875,
      473.3544921875,
      484.4013671875,
      484.4130859375,
      465.0341796875,
      465.0458984375,
      476.1005859375,
      476.1201171875,
      476.1708984375,
      476.1826171875,
      478.9208984375,
      465.0380859375,
      465.0498046875,
      476.1083984375,
      476.1240234375,
      487.1669921875,
      487.1826171875,
      465.2958984375,
      470.9599609375,
      476.4482421875,
      487.4951171875,
      487.5068359375,
      469.9404296875,
      469.9521484375,
      481.0029296875,
      481.0185546875,
      468.0849609375,
      468.1005859375,
      479.1591796875,
      485.0185546875,
      490.2177734375,
      468.0927734375,
      468.1044921875,
      479.1630859375,
      479.1787109375,
      490.2216796875,
      490.2373046875,
      472.6982421875,
      472.7099609375,
      483.7607421875,
      483.7763671875,
      470.8427734375,
      470.8544921875,
      481.9091796875,
      492.9560546875,
      492.9755859375,
      487.5654296875,
      487.5771484375,
      479.1044921875,
      479.1162109375,
      490.1787109375,
      490.1943359375,
      491.1591796875,
      491.1708984375,
      491.1669921875,
      497.0302734375,
      502.2099609375,
      481.8466796875,
      481.8583984375,
      492.9169921875,
      492.9326171875,
      487.4716796875,
      487.4833984375,
      498.5380859375,
      509.4638671875,
      476.3623046875,
      484.0380859375,
      492.2216796875,
      487.6669921875,
      487.6826171875,
      476.5185546875,
      476.5302734375,
      487.5849609375,
      487.6044921875,
      498.6513671875,
      498.6669921875,
      476.5224609375,
      487.5732421875,
      487.5966796875,
      498.6435546875,
      498.6552734375,
      481.1279296875,
      481.1396484375,
      492.1982421875,
      492.2138671875,
      491.4052734375,
      491.4169921875,
      487.5263671875,
      487.5458984375,
      498.6005859375,
      493.1552734375,
      493.1669921875,
      504.2490234375,
      504.2646484375,
      482.0576171875,
      482.0693359375,
      497.6943359375,
      497.7138671875,
      493.1630859375,
      493.1748046875,
      495.9169921875,
      506.8740234375,
      482.0458984375,
      493.1005859375,
      493.1162109375,
      504.1591796875,
      504.1787109375,
      484.7802734375,
      484.7919921875,
      495.8466796875,
      503.5302734375,
      495.9169921875,
      495.9287109375,
      498.6708984375,
      509.6201171875,
      484.7958984375,
      495.8544921875,
      495.8701171875,
      506.9130859375,
      506.9287109375,
      484.7880859375,
      484.7998046875,
      495.8583984375,
      506.9052734375,
      506.9169921875,
      499.6279296875,
      487.5380859375,
      498.5888671875,
      498.6044921875,
      493.1669921875,
      493.1826171875,
      504.2373046875,
      504.2529296875,
      487.5380859375,
      487.5537109375,
      498.6083984375,
      509.6552734375,
      509.6669921875,
      490.17578125,
      490.189453125,
      497.880859375,
      505.861328125,
      505.873046875,
      501.310546875,
      501.322265625,
      512.373046875,
      512.3876953125,
      498.4404296875,
      498.4560546875,
      509.5068359375,
      509.5224609375,
      504.0595703125,
      504.0703125,
      515.12890625,
      515.14453125,
      492.9375,
      492.94921875
    ],
    "peak_mb": 515.14453125
  },
  "thermal": {
    "before": "none",
    "after": "none"
  },
  "output_paths": [
    "outputs-zero-dce\/1.png",
    "outputs-zero-dce\/111.png",
    "outputs-zero-dce\/146.png",
    "outputs-zero-dce\/179.png",
    "outputs-zero-dce\/22.png",
    "outputs-zero-dce\/23.png",
    "outputs-zero-dce\/493.png",
    "outputs-zero-dce\/547.png",
    "outputs-zero-dce\/55.png",
    "outputs-zero-dce\/665.png",
    "outputs-zero-dce\/669.png",
    "outputs-zero-dce\/748.png",
    "outputs-zero-dce\/778.png",
    "outputs-zero-dce\/780.png",
    "outputs-zero-dce\/79.png"
  ],
  "success": true
}