{
  "model_id": "mobileie-6ch",
  "artifact_sha256": "5c3978c66ffe049b280013886e07a9d35cda495180b5031c609d750ce7c0ef9d",
  "device": {
    "model": "A142",
    "android_release": "16",
    "android_sdk": 36,
    "build_fingerprint": "Nothing\/Pacman\/Pacman:16\/BP2A.250605.031.A3\/2608130941:user\/release-keys",
    "soc": "MT6886"
  },
  "runtime": {
    "name": "onnxruntime",
    "version": "1.19.2"
  },
  "backend": "cpu",
  "precision": "float32",
  "image_ids": [
    "55.png"
  ],
  "warmup_count": 5,
  "load_time_ns": 101340692,
  "images": [
    {
      "image_id": "55.png",
      "model_ns": [
        290932616,
        271499000,
        283627384
      ],
      "e2e_ns": [
        290942385,
        271504846,
        283633000
      ]
    }
  ],
  "pss": {
    "samples_mb": [
      43.5888671875,
      171.0888671875,
      281.2802734375,
      324.8623046875,
      297.859375,
      320.1591796875
    ],
    "peak_mb": 324.8623046875
  },
  "thermal": {
    "before": "none",
    "after": "none"
  },
  "output_paths": [],
  "success": true
}