{
  "model_id": "sci-medium",
  "artifact_sha256": "006ae2e76b5a795dbf31d546eda90e4e6ff571035dc0a65aba206ea34b679716",
  "device": {
    "model": "A142",
    "android_release": "16",
    "android_sdk": 36,
    "build_fingerprint": "Nothing\/Pacman\/Pacman:16\/BP2A.250605.031.A3\/2608130941:user\/release-keys",
    "soc": "MT6886"
  },
  "runtime": {
    "name": "onnxruntime",
    "version": "1.19.2"
  },
  "backend": "cpu",
  "precision": "float32",
  "image_ids": [
    "1.png",
    "111.png",
    "146.png",
    "179.png",
    "22.png",
    "23.png",
    "493.png",
    "547.png",
    "55.png",
    "665.png",
    "669.png",
    "748.png",
    "778.png",
    "780.png",
    "79.png"
  ],
  "warmup_count": 5,
  "load_time_ns": 122728231,
  "images": [
    {
      "image_id": "1.png",
      "model_ns": [
        67662692,
        75715461,
        69768308
      ],
      "e2e_ns": [
        67683384,
        75729231,
        69782154
      ]
    },
    {
      "image_id": "111.png",
      "model_ns": [
        85165538,
        67831384,
        70469154
      ],
      "e2e_ns": [
        85186154,
        67844077,
        70482462
      ]
    },
    {
      "image_id": "146.png",
      "model_ns": [
        69852308,
        74255154,
        74732923
      ],
      "e2e_ns": [
        69889538,
        74269231,
        74745769
      ]
    },
    {
      "image_id": "179.png",
      "model_ns": [
        78034538,
        85285154,
        69937154
      ],
      "e2e_ns": [
        78075384,
        85299385,
        69950769
      ]
    },
    {
      "image_id": "22.png",
      "model_ns": [
        81842154,
        70900231,
        70030384
      ],
      "e2e_ns": [
        81862231,
        70913769,
        70043923
      ]
    },
    {
      "image_id": "23.png",
      "model_ns": [
        70154462,
        94761231,
        81704385
      ],
      "e2e_ns": [
        70176615,
        94774538,
        81717231
      ]
    },
    {
      "image_id": "493.png",
      "model_ns": [
        74976308,
        70120077,
        68162385
      ],
      "e2e_ns": [
        74996924,
        70133000,
        68175308
      ]
    },
    {
      "image_id": "547.png",
      "model_ns": [
        71079692,
        81210231,
        70742846
      ],
      "e2e_ns": [
        71103692,
        81222154,
        70756539
      ]
    },
    {
      "image_id": "55.png",
      "model_ns": [
        70891462,
        66825769,
        68721231
      ],
      "e2e_ns": [
        70912615,
        66839384,
        68734769
      ]
    },
    {
      "image_id": "665.png",
      "model_ns": [
        94445000,
        70671615,
        66795692
      ],
      "e2e_ns": [
        94467385,
        70685231,
        66808923
      ]
    },
    {
      "image_id": "669.png",
      "model_ns": [
        70829846,
        66757923,
        68363615
      ],
      "e2e_ns": [
        70851615,
        66771154,
        68377231
      ]
    },
    {
      "image_id": "748.png",
      "model_ns": [
        69924307,
        68643693,
        71724308
      ],
      "e2e_ns": [
        69945846,
        68656846,
        71737538
      ]
    },
    {
      "image_id": "778.png",
      "model_ns": [
        66373539,
        69081769,
        70404231
      ],
      "e2e_ns": [
        66393923,
        69095384,
        70416923
      ]
    },
    {
      "image_id": "780.png",
      "model_ns": [
        67574153,
        77286154,
        73569231
      ],
      "e2e_ns": [
        67596231,
        77299615,
        73583154
      ]
    },
    {
      "image_id": "79.png",
      "model_ns": [
        66696616,
        66748307,
        69428307
      ],
      "e2e_ns": [
        66717231,
        66761847,
        69441769
      ]
    }
  ],
  "pss": {
    "samples_mb": [
      48.4365234375,
      78.5009765625,
      100.865234375,
      109.560546875,
      126.1142578125,
      127.708984375,
      129.6552734375,
      142.6279296875,
      114.4365234375,
      132.9599609375,
      165.51171875,
      154.6259765625,
      192.828125,
      157.66015625,
      210.2529296875,
      171.3251953125,
      133.1884765625,
      162.9697265625,
      156.2744140625,
      190.9345703125,
      179.9345703125,
      216.8046875,
      190.94921875,
      136.5234375,
      185.4765625,
      171.72265625,
      207.7734375,
      211.93359375,
      217.00390625,
      216.03515625,
      171.06640625,
      218.68359375
    ],
    "peak_mb": 218.68359375
  },
  "thermal": {
    "before": "light",
    "after": "light"
  },
  "output_paths": [
    "outputs\/1.png",
    "outputs\/111.png",
    "outputs\/146.png",
    "outputs\/179.png",
    "outputs\/22.png",
    "outputs\/23.png",
    "outputs\/493.png",
    "outputs\/547.png",
    "outputs\/55.png",
    "outputs\/665.png",
    "outputs\/669.png",
    "outputs\/748.png",
    "outputs\/778.png",
    "outputs\/780.png",
    "outputs\/79.png"
  ],
  "success": true
}