{
  "model_id": "mobileie-6ch-4032x3024",
  "artifact_sha256": "5c3978c66ffe049b280013886e07a9d35cda495180b5031c609d750ce7c0ef9d",
  "device": {
    "model": "M2101K6G",
    "android_release": "13",
    "android_sdk": 33,
    "build_fingerprint": "Redmi\/sweet_global\/sweet:13\/TKQ1.221013.002\/V14.0.8.0.TKFMIXM:user\/release-keys",
    "soc": "SM7150"
  },
  "runtime": {
    "name": "onnxruntime",
    "version": "1.19.2"
  },
  "backend": "cpu",
  "precision": "float32",
  "image_ids": [],
  "warmup_count": 5,
  "load_time_ns": 165661094,
  "images": [],
  "pss": {
    "samples_mb": [
      57.6943359375,
      116.2138671875,
      179.7978515625,
      188.8828125,
      252.8984375
    ],
    "peak_mb": 252.8984375
  },
  "thermal": {
    "before": "none",
    "after": "none"
  },
  "output_paths": [],
  "success": false,
  "failure_reason": "OutOfMemoryError: Failed to allocate a 146313232 byte allocation with 8388608 free bytes and 113MB until OOM, target footprint 158153712, growth limit 268435456"
}