{
  "model_id": "ruas-lol",
  "artifact_sha256": "15b9443756258426f2fd0e41002199dda2316cd766ed9917eba5a2a0705f6be5",
  "device": {
    "model": "A142",
    "android_release": "16",
    "android_sdk": 36,
    "build_fingerprint": "Nothing\/Pacman\/Pacman:16\/BP2A.250605.031.A3\/2608130941:user\/release-keys",
    "soc": "MT6886"
  },
  "runtime": {
    "name": "onnxruntime",
    "version": "1.19.2"
  },
  "backend": "cpu",
  "precision": "float32",
  "image_ids": [
    "1.png",
    "111.png",
    "146.png",
    "179.png",
    "22.png",
    "23.png",
    "493.png",
    "547.png",
    "55.png",
    "665.png",
    "669.png",
    "748.png",
    "778.png",
    "780.png",
    "79.png"
  ],
  "warmup_count": 5,
  "load_time_ns": 154772308,
  "images": [
    {
      "image_id": "1.png",
      "model_ns": [
        141386846,
        145631385,
        128353846
      ],
      "e2e_ns": [
        141397462,
        145637308,
        128359923
      ]
    },
    {
      "image_id": "111.png",
      "model_ns": [
        126396231,
        121050231,
        121972000
      ],
      "e2e_ns": [
        126405308,
        121056692,
        121978461
      ]
    },
    {
      "image_id": "146.png",
      "model_ns": [
        123992539,
        124113615,
        123420308
      ],
      "e2e_ns": [
        124009616,
        124119923,
        123426692
      ]
    },
    {
      "image_id": "179.png",
      "model_ns": [
        124490770,
        122444000,
        123427615
      ],
      "e2e_ns": [
        124500692,
        122456692,
        123436616
      ]
    },
    {
      "image_id": "22.png",
      "model_ns": [
        121669231,
        128343384,
        121244000
      ],
      "e2e_ns": [
        121680000,
        128350692,
        121250077
      ]
    },
    {
      "image_id": "23.png",
      "model_ns": [
        129055384,
        121423385,
        125406461
      ],
      "e2e_ns": [
        129077538,
        121432077,
        125412000
      ]
    },
    {
      "image_id": "493.png",
      "model_ns": [
        121718538,
        119610077,
        121161154
      ],
      "e2e_ns": [
        121728616,
        119615769,
        121173154
      ]
    },
    {
      "image_id": "547.png",
      "model_ns": [
        122072000,
        123681923,
        121435693
      ],
      "e2e_ns": [
        122081924,
        123688308,
        121440692
      ]
    },
    {
      "image_id": "55.png",
      "model_ns": [
        120792231,
        121246769,
        120503615
      ],
      "e2e_ns": [
        120801000,
        121253154,
        120509000
      ]
    },
    {
      "image_id": "665.png",
      "model_ns": [
        119562077,
        128678769,
        124890770
      ],
      "e2e_ns": [
        119571692,
        128685154,
        124902846
      ]
    },
    {
      "image_id": "669.png",
      "model_ns": [
        119578847,
        125922154,
        121774846
      ],
      "e2e_ns": [
        119589000,
        125928615,
        121780538
      ]
    },
    {
      "image_id": "748.png",
      "model_ns": [
        120090538,
        120158154,
        125604000
      ],
      "e2e_ns": [
        120101769,
        120164692,
        125609539
      ]
    },
    {
      "image_id": "778.png",
      "model_ns": [
        118806846,
        127331077,
        122442539
      ],
      "e2e_ns": [
        118816308,
        127336307,
        122449308
      ]
    },
    {
      "image_id": "780.png",
      "model_ns": [
        124768693,
        121300616,
        124260076
      ],
      "e2e_ns": [
        124779077,
        121307077,
        124266154
      ]
    },
    {
      "image_id": "79.png",
      "model_ns": [
        122037769,
        124650462,
        121225230
      ],
      "e2e_ns": [
        122068923,
        124659461,
        121230769
      ]
    }
  ],
  "pss": {
    "samples_mb": [
      42.357421875,
      112.3642578125,
      162.2080078125,
      191.828125,
      156.076171875,
      197.6591796875,
      184.6513671875,
      151.3818359375,
      156.861328125,
      191.841796875,
      195.8896484375,
      226.1318359375,
      198.3271484375,
      167.6005859375,
      197.9638671875,
      185.1123046875,
      162.6904296875,
      207.2685546875,
      175.5263671875,
      220.2841796875,
      184.2998046875,
      225.8623046875,
      187.3349609375,
      223.0771484375,
      171.0693359375,
      209.1005859375,
      253.6865234375,
      206.2880859375,
      250.8740234375,
      195.3349609375,
      236.9013671875,
      206.4755859375,
      236.9169921875,
      193.3388671875,
      220.2373046875,
      270.4912109375
    ],
    "peak_mb": 270.4912109375
  },
  "thermal": {
    "before": "none",
    "after": "none"
  },
  "output_paths": [
    "outputs-ruas-lol\/1.png",
    "outputs-ruas-lol\/111.png",
    "outputs-ruas-lol\/146.png",
    "outputs-ruas-lol\/179.png",
    "outputs-ruas-lol\/22.png",
    "outputs-ruas-lol\/23.png",
    "outputs-ruas-lol\/493.png",
    "outputs-ruas-lol\/547.png",
    "outputs-ruas-lol\/55.png",
    "outputs-ruas-lol\/665.png",
    "outputs-ruas-lol\/669.png",
    "outputs-ruas-lol\/748.png",
    "outputs-ruas-lol\/778.png",
    "outputs-ruas-lol\/780.png",
    "outputs-ruas-lol\/79.png"
  ],
  "success": true
}