{
  "model_id": "sci-medium",
  "artifact_sha256": "006ae2e76b5a795dbf31d546eda90e4e6ff571035dc0a65aba206ea34b679716",
  "device": {
    "model": "M2010J19SG",
    "android_release": "12",
    "android_sdk": 31,
    "build_fingerprint": "Redmi\/lime_global\/lime:12\/SKQ1.211202.001\/V14.0.3.0.SJQMIXM:user\/release-keys",
    "soc": "SM6115"
  },
  "runtime": {
    "name": "onnxruntime",
    "version": "1.19.2"
  },
  "backend": "cpu",
  "precision": "float32",
  "image_ids": [
    "1.png",
    "111.png",
    "146.png",
    "179.png",
    "22.png",
    "23.png",
    "493.png",
    "547.png",
    "55.png",
    "665.png",
    "669.png",
    "748.png",
    "778.png",
    "780.png",
    "79.png"
  ],
  "warmup_count": 5,
  "load_time_ns": 236493177,
  "images": [
    {
      "image_id": "1.png",
      "model_ns": [
        205940260,
        150978073,
        90583854
      ],
      "e2e_ns": [
        205991719,
        150999323,
        90604375
      ]
    },
    {
      "image_id": "111.png",
      "model_ns": [
        136609479,
        94094427,
        104159375
      ],
      "e2e_ns": [
        136638958,
        94117448,
        104181667
      ]
    },
    {
      "image_id": "146.png",
      "model_ns": [
        74807656,
        58103907,
        57081354
      ],
      "e2e_ns": [
        74859375,
        58122031,
        57097760
      ]
    },
    {
      "image_id": "179.png",
      "model_ns": [
        71572291,
        58693386,
        68839635
      ],
      "e2e_ns": [
        71598906,
        58711719,
        68873334
      ]
    },
    {
      "image_id": "22.png",
      "model_ns": [
        60146770,
        67158593,
        62912604
      ],
      "e2e_ns": [
        60172709,
        67176042,
        62931302
      ]
    },
    {
      "image_id": "23.png",
      "model_ns": [
        59587344,
        58748125,
        61839323
      ],
      "e2e_ns": [
        59611875,
        58765782,
        61855990
      ]
    },
    {
      "image_id": "493.png",
      "model_ns": [
        63545885,
        59988489,
        67634583
      ],
      "e2e_ns": [
        63574635,
        60009531,
        67652343
      ]
    },
    {
      "image_id": "547.png",
      "model_ns": [
        59196875,
        59439844,
        62603958
      ],
      "e2e_ns": [
        59225104,
        59457709,
        62621927
      ]
    },
    {
      "image_id": "55.png",
      "model_ns": [
        62573958,
        60456249,
        79268646
      ],
      "e2e_ns": [
        62601354,
        60473698,
        79299740
      ]
    },
    {
      "image_id": "665.png",
      "model_ns": [
        63069063,
        62511458,
        72385261
      ],
      "e2e_ns": [
        63095260,
        62528593,
        72401875
      ]
    },
    {
      "image_id": "669.png",
      "model_ns": [
        56050885,
        67277813,
        55703385
      ],
      "e2e_ns": [
        56078073,
        67309583,
        55721250
      ]
    },
    {
      "image_id": "748.png",
      "model_ns": [
        57938073,
        62975469,
        54912760
      ],
      "e2e_ns": [
        57966302,
        62993489,
        54930052
      ]
    },
    {
      "image_id": "778.png",
      "model_ns": [
        60866041,
        69338854,
        58744584
      ],
      "e2e_ns": [
        60893385,
        69369375,
        58762604
      ]
    },
    {
      "image_id": "780.png",
      "model_ns": [
        66636511,
        58909740,
        60335104
      ],
      "e2e_ns": [
        66664844,
        58928437,
        60352448
      ]
    },
    {
      "image_id": "79.png",
      "model_ns": [
        54700313,
        55658177,
        62502396
      ],
      "e2e_ns": [
        54728230,
        55675312,
        62521510
      ]
    }
  ],
  "pss": {
    "samples_mb": [
      38.708984375,
      67.8564453125,
      89.4091796875,
      107.830078125,
      112.796875,
      128.826171875,
      105.19140625,
      86.8427734375,
      92.25,
      110.0498046875,
      127.6025390625,
      122.2705078125,
      129.9404296875,
      136.185546875,
      131.3837890625,
      116.0224609375,
      122.2646484375,
      118.6787109375,
      138.1494140625,
      135.63671875,
      132.552734375,
      147.115234375,
      131.7021484375,
      136.4892578125,
      137.947265625,
      146.9404296875,
      148.806640625,
      136.671875,
      132.99609375,
      142.0078125,
      138.55078125,
      162.16015625
    ],
    "peak_mb": 162.16015625
  },
  "thermal": {
    "before": "none",
    "after": "none"
  },
  "output_paths": [
    "outputs-sci-medium\/1.png",
    "outputs-sci-medium\/111.png",
    "outputs-sci-medium\/146.png",
    "outputs-sci-medium\/179.png",
    "outputs-sci-medium\/22.png",
    "outputs-sci-medium\/23.png",
    "outputs-sci-medium\/493.png",
    "outputs-sci-medium\/547.png",
    "outputs-sci-medium\/55.png",
    "outputs-sci-medium\/665.png",
    "outputs-sci-medium\/669.png",
    "outputs-sci-medium\/748.png",
    "outputs-sci-medium\/778.png",
    "outputs-sci-medium\/780.png",
    "outputs-sci-medium\/79.png"
  ],
  "success": true
}