{
  "model_id": "mobileie-6ch-4032x3024",
  "artifact_sha256": "5c3978c66ffe049b280013886e07a9d35cda495180b5031c609d750ce7c0ef9d",
  "device": {
    "model": "A142",
    "android_release": "16",
    "android_sdk": 36,
    "build_fingerprint": "Nothing\/Pacman\/Pacman:16\/BP2A.250605.031.A3\/2608130941:user\/release-keys",
    "soc": "MT6886"
  },
  "runtime": {
    "name": "onnxruntime",
    "version": "1.19.2"
  },
  "backend": "cpu",
  "precision": "float32",
  "image_ids": [],
  "warmup_count": 5,
  "load_time_ns": 111499923,
  "images": [],
  "pss": {
    "samples_mb": [
      46.169921875,
      171.82421875,
      203.712890625
    ],
    "peak_mb": 203.712890625
  },
  "thermal": {
    "before": "none",
    "after": "none"
  },
  "output_paths": [],
  "success": false,
  "failure_reason": "OutOfMemoryError: Failed to allocate a 146313232 byte allocation with 100663296 free bytes and 113MB until OOM, target footprint 249798112, growth limit 268435456"
}