{
  "model_id": "mobileie-6ch-4032x3024",
  "artifact_sha256": "5c3978c66ffe049b280013886e07a9d35cda495180b5031c609d750ce7c0ef9d",
  "device": {
    "model": "M2010J19SG",
    "android_release": "12",
    "android_sdk": 31,
    "build_fingerprint": "Redmi\/lime_global\/lime:12\/SKQ1.211202.001\/V14.0.3.0.SJQMIXM:user\/release-keys",
    "soc": "SM6115"
  },
  "runtime": {
    "name": "onnxruntime",
    "version": "1.19.2"
  },
  "backend": "cpu",
  "precision": "float32",
  "image_ids": [],
  "warmup_count": 5,
  "load_time_ns": 350341198,
  "images": [],
  "pss": {
    "samples_mb": [
      38.998046875,
      71.958984375,
      116.939453125,
      161.2333984375,
      173.021484375,
      181.61328125,
      190.255859375,
      198.8818359375,
      211.314453125
    ],
    "peak_mb": 211.314453125
  },
  "thermal": {
    "before": "none",
    "after": "none"
  },
  "output_paths": [],
  "success": false,
  "failure_reason": "OutOfMemoryError: Failed to allocate a 146313232 byte allocation with 8388608 free bytes and 113MB until OOM, target footprint 157832272, growth limit 268435456"
}