{
  "model_id": "mobileie-6ch-900x600",
  "artifact_sha256": "5c3978c66ffe049b280013886e07a9d35cda495180b5031c609d750ce7c0ef9d",
  "device": {
    "model": "A142",
    "android_release": "16",
    "android_sdk": 36,
    "build_fingerprint": "Nothing\/Pacman\/Pacman:16\/BP2A.250605.031.A3\/2608130941:user\/release-keys",
    "soc": "MT6886"
  },
  "runtime": {
    "name": "onnxruntime",
    "version": "1.19.2"
  },
  "backend": "cpu",
  "precision": "float32",
  "image_ids": [
    "1.png",
    "111.png",
    "146.png",
    "179.png",
    "22.png",
    "23.png",
    "493.png",
    "547.png",
    "55.png",
    "665.png",
    "669.png",
    "748.png",
    "778.png",
    "780.png",
    "79.png"
  ],
  "warmup_count": 5,
  "load_time_ns": 116879308,
  "images": [
    {
      "image_id": "1.png",
      "model_ns": [
        765590769,
        745437846,
        751235923
      ],
      "e2e_ns": [
        765601231,
        745443461,
        751242154
      ]
    },
    {
      "image_id": "111.png",
      "model_ns": [
        734757770,
        741131153,
        752408308
      ],
      "e2e_ns": [
        734768000,
        741137846,
        752414538
      ]
    },
    {
      "image_id": "146.png",
      "model_ns": [
        818160231,
        828205231,
        761647923
      ],
      "e2e_ns": [
        818171385,
        828211385,
        761654462
      ]
    },
    {
      "image_id": "179.png",
      "model_ns": [
        733330462,
        733493461,
        797440616
      ],
      "e2e_ns": [
        733341462,
        733500231,
        797448308
      ]
    },
    {
      "image_id": "22.png",
      "model_ns": [
        844253230,
        846946846,
        823946385
      ],
      "e2e_ns": [
        844269462,
        846955077,
        823955154
      ]
    },
    {
      "image_id": "23.png",
      "model_ns": [
        857975461,
        860022231,
        846034769
      ],
      "e2e_ns": [
        857991923,
        860033462,
        846044846
      ]
    },
    {
      "image_id": "493.png",
      "model_ns": [
        812118384,
        853043384,
        907823461
      ],
      "e2e_ns": [
        812135077,
        853053231,
        907840000
      ]
    },
    {
      "image_id": "547.png",
      "model_ns": [
        940636923,
        930966154,
        937336923
      ],
      "e2e_ns": [
        940663769,
        930984615,
        937346231
      ]
    },
    {
      "image_id": "55.png",
      "model_ns": [
        929715692,
        940793846,
        924775692
      ],
      "e2e_ns": [
        929741462,
        940805000,
        924785923
      ]
    },
    {
      "image_id": "665.png",
      "model_ns": [
        925093846,
        934185924,
        931370231
      ],
      "e2e_ns": [
        925111000,
        934196923,
        931384308
      ]
    },
    {
      "image_id": "669.png",
      "model_ns": [
        924016308,
        943466846,
        940526769
      ],
      "e2e_ns": [
        924033539,
        943473846,
        940536539
      ]
    },
    {
      "image_id": "748.png",
      "model_ns": [
        906504000,
        921495077,
        920959308
      ],
      "e2e_ns": [
        906521539,
        921507384,
        920969923
      ]
    },
    {
      "image_id": "778.png",
      "model_ns": [
        931606154,
        935242077,
        939778462
      ],
      "e2e_ns": [
        931627154,
        935254462,
        939791077
      ]
    },
    {
      "image_id": "780.png",
      "model_ns": [
        921239461,
        921344923,
        922889154
      ],
      "e2e_ns": [
        921256231,
        921355077,
        922908000
      ]
    },
    {
      "image_id": "79.png",
      "model_ns": [
        926884307,
        940789847,
        931430770
      ],
      "e2e_ns": [
        926899462,
        940832538,
        931443923
      ]
    }
  ],
  "pss": {
    "samples_mb": [
      41.42578125,
      144.802734375,
      306.1669921875,
      313.5498046875,
      483.6669921875,
      615.5146484375,
      631.6005859375,
      594.4013671875,
      609.919921875,
      619.279296875,
      600.623046875,
      625.681640625,
      625.638671875,
      619.3369140625,
      636.0078125,
      644.01171875,
      644.0234375,
      613.1171875,
      637.953125,
      638.33203125,
      663.1796875,
      688.0234375,
      697.62109375,
      644.60546875,
      669.4375,
      594.83984375,
      594.8515625,
      611.62890625,
      630.06640625,
      654.8984375,
      654.91015625,
      679.75390625,
      638.3515625,
      663.171875,
      663.1875,
      594.91796875,
      619.609375,
      619.4912109375,
      644.1767578125,
      660.9111328125,
      679.33203125,
      679.248046875,
      644.0087890625,
      668.8076171875,
      668.8056640625,
      600.5244140625,
      625.3408203125,
      625.3564453125,
      650.1923828125,
      675.0283203125,
      608.4150390625,
      613.0166015625,
      629.7353515625,
      648.0693359375,
      648.0576171875,
      672.8896484375,
      606.5888671875,
      606.6005859375,
      631.4208984375,
      656.2529296875,
      656.2685546875,
      681.0966796875,
      619.0693359375,
      619.0810546875,
      643.9013671875,
      660.6435546875,
      658.6669921875,
      679.0888671875,
      612.7802734375,
      612.7919921875,
      637.6123046875,
      662.4443359375,
      662.4599609375,
      687.2880859375,
      619.0771484375,
      619.0888671875,
      643.9091796875,
      643.9248046875,
      668.7646484375,
      685.4951171875,
      618.9599609375,
      618.6826171875,
      643.115234375,
      643.078125,
      667.849609375,
      692.68359375,
      692.28515625,
      630.2412109375,
      655.0615234375,
      655.0771484375,
      679.7275390625,
      704.5595703125,
      703.4404296875,
      639.2880859375,
      657.7119140625,
      657.7353515625,
      682.111328125,
      706.76171875,
      706.7734375,
      653.16796875,
      653.1796875,
      678.01171875,
      678.02734375,
      702.859375,
      727.0234375,
      727.703125,
      652.96875,
      652.98046875,
      669.7109375,
      688.1484375,
      688.1640625,
      713,
      713.01171875,
      659.234375,
      676.81640625,
      684.06640625,
      708.8984375,
      708.9140625,
      733.75,
      733.765625,
      652.9765625,
      677.8046875,
      677.8203125,
      694.55859375,
      712.98828125,
      713,
      659.24609375,
      659.2578125,
      684.078125,
      684.09765625,
      708.92578125,
      733.75390625,
      733.76953125,
      659.16015625,
      659.171875,
      684.00390625,
      708.83984375,
      708.85546875,
      725.58203125,
      744.01171875,
      744.02734375,
      690.203125,
      690.21484375,
      715.0390625,
      715.0546875,
      640.57421875,
      665.39453125,
      665.41015625,
      690.2421875,
      690.2578125,
      715.08984375,
      718.02734375,
      659.23828125,
      675.9609375,
      675.98046875,
      694.40625,
      719.2421875,
      719.25390625,
      646.76171875,
      646.7734375,
      671.59375,
      696.42578125,
      696.44140625,
      721.26953125,
      721.28515625,
      659.2421875,
      684.05859375,
      684.07421875,
      700.8125,
      719.24609375,
      719.2578125,
      652.90625,
      652.91796875,
      677.35546875,
      702.1875,
      702.203125,
      727.03125,
      727.046875,
      658.8203125,
      668.685546875,
      683.65234375,
      708.4921875,
      708.5078125,
      725.23828125,
      658.703125,
      658.71484375,
      683.5390625,
      683.5625,
      708.390625,
      733.21875,
      733.234375,
      670.349609375,
      670.361328125,
      695.185546875,
      720.025390625,
      720.041015625,
      744.869140625,
      744.884765625,
      680.720703125,
      699.146484375,
      699.162109375,
      723.994140625,
      742.978515625,
      748.837890625,
      688.705078125,
      688.716796875,
      713.541015625,
      713.556640625,
      738.392578125,
      763.224609375,
      763.240234375,
      694.814453125,
      694.826171875,
      711.564453125
    ],
    "peak_mb": 763.240234375
  },
  "thermal": {
    "before": "none",
    "after": "none"
  },
  "output_paths": [
    "outputs-mobileie-6ch-900x600\/1.png",
    "outputs-mobileie-6ch-900x600\/111.png",
    "outputs-mobileie-6ch-900x600\/146.png",
    "outputs-mobileie-6ch-900x600\/179.png",
    "outputs-mobileie-6ch-900x600\/22.png",
    "outputs-mobileie-6ch-900x600\/23.png",
    "outputs-mobileie-6ch-900x600\/493.png",
    "outputs-mobileie-6ch-900x600\/547.png",
    "outputs-mobileie-6ch-900x600\/55.png",
    "outputs-mobileie-6ch-900x600\/665.png",
    "outputs-mobileie-6ch-900x600\/669.png",
    "outputs-mobileie-6ch-900x600\/748.png",
    "outputs-mobileie-6ch-900x600\/778.png",
    "outputs-mobileie-6ch-900x600\/780.png",
    "outputs-mobileie-6ch-900x600\/79.png"
  ],
  "success": true
}